[{"schema_version":"quest_dispatch_v1","id":"AOA-TECH-Q-0001","repo":"aoa-techniques","state":"done","band":"frontier","difficulty":"d2_slice","risk":"r1_repo_local","control_mode":"codex_supervised","delegate_tier":"executor","split_required":false,"write_scope":"repo_local","requires_artifacts":["bounded_plan","work_result","verification_result"],"activation_mode":"immediate","source_path":"quests/AOA-TECH-Q-0001.yaml","public_safe":true,"fallback_tier":"verifier","wrapper_class":"local_patcher"},{"schema_version":"quest_dispatch_v1","id":"AOA-TECH-Q-0002","repo":"aoa-techniques","state":"done","band":"frontier","difficulty":"d2_slice","risk":"r1_repo_local","control_mode":"codex_supervised","delegate_tier":"planner","split_required":false,"write_scope":"docs_only","requires_artifacts":["bounded_plan","work_result"],"activation_mode":"on_review_of","source_path":"quests/AOA-TECH-Q-0002.yaml","public_safe":true,"fallback_tier":"verifier","wrapper_class":"codex_primary"},{"schema_version":"quest_dispatch_v1","id":"AOA-TECH-Q-0003","repo":"aoa-techniques","state":"captured","band":"near","difficulty":"d3_seam","risk":"r2_contract","control_mode":"human_codex_copilot","delegate_tier":"planner","split_required":true,"write_scope":"repo_local","requires_artifacts":["bounded_plan","guardrail_check","verification_result"],"activation_mode":"on_review_of","source_path":"quests/AOA-TECH-Q-0003.yaml","public_safe":true,"fallback_tier":"verifier","wrapper_class":"hybrid"},{"schema_version":"quest_dispatch_v1","id":"AOA-TECH-Q-0004","repo":"aoa-techniques","state":"captured","band":"latent","difficulty":"d3_seam","risk":"r1_repo_local","control_mode":"codex_supervised","delegate_tier":"planner","split_required":true,"write_scope":"docs_only","requires_artifacts":["recurrence_evidence","promotion_decision"],"activation_mode":"on_recurrence","source_path":"quests/AOA-TECH-Q-0004.yaml","public_safe":true,"fallback_tier":"verifier","wrapper_class":"codex_primary"},{"schema_version":"quest_dispatch_v1","id":"AOA-TECH-Q-0005","repo":"aoa-techniques","state":"captured","band":"near","difficulty":"d3_seam","risk":"r2_contract","control_mode":"human_codex_copilot","delegate_tier":"planner","split_required":true,"write_scope":"repo_local","requires_artifacts":["bounded_plan","work_result","verification_result"],"activation_mode":"manual","source_path":"quests/AOA-TECH-Q-0005.yaml","public_safe":true,"fallback_tier":"conductor","wrapper_class":"hybrid"},{"schema_version":"quest_dispatch_v1","id":"AOA-TECH-Q-0006","repo":"aoa-techniques","state":"captured","band":"near","difficulty":"d3_seam","risk":"r2_contract","control_mode":"human_codex_copilot","delegate_tier":"planner","split_required":true,"write_scope":"repo_local","requires_artifacts":["recurrence_evidence","promotion_decision"],"activation_mode":"on_review_of","source_path":"quests/AOA-TECH-Q-0006.yaml","public_safe":true,"fallback_tier":"verifier","wrapper_class":"codex_primary"},{"schema_version":"quest_dispatch_v1","id":"AOA-TECH-Q-0007","repo":"aoa-techniques","state":"captured","band":"near","difficulty":"d3_seam","risk":"r2_contract","control_mode":"human_codex_copilot","delegate_tier":"planner","split_required":true,"write_scope":"repo_local","requires_artifacts":["recurrence_evidence","promotion_decision"],"activation_mode":"on_review_of","source_path":"quests/AOA-TECH-Q-0007.yaml","public_safe":true,"fallback_tier":"verifier","wrapper_class":"codex_primary"}]
